PublishedAt,Title,description
2017-05-10T17:29:00Z,Whole Foods Overhauls Board; Vows Big Changes,Whole Foods is dramatically reshaping its board in an effort to show it is open to change after an activist investor last month publicly urged the organic-grocery chain to explore a sale and speed up its turnaround efforts.
2017-05-10T23:14:33Z,4 ways Trump miscalculated the Comey firing,"Donald Trump has been president for 110 days. In that time, he has fired an acting attorney general, his national security adviser, dozens of federal prosecutors, including one who was investigating him, and, on Tuesday night, the director of the FBI, James Comey."
2017-05-10T20:29:01Z,Source close to Comey says there were 2 reasons the FBI director was fired,"There are two reasons why President Donald Trump fired James Comey, according to a source close to the now-former FBI director:"
,Tapper: The real reasons Trump fired Comey - CNN Video,CNN's Jake Tapper says one of the reasons President Donald Trump fired James Comey was that the former FBI director would not give him assurance of personal loyalty.
2017-05-10T20:36:03Z,Comey firing sends shockwaves through FBI rank-and-file,"News of James Comey's firing Tuesday night sent shockwaves through the FBI, where the dismissal of the generally well-liked bureau director immediately impacted the thousands of agents nationwide."
,WH: Comey tossed 'stick of dynamite' into DOJ - CNN Video,"When asked about why President Trump was moved to fire James Comey when he previously praised him, Deputy press secretary Sarah Huckabee Sanders said that circumstances change when becoming president and throwing ""a stick of dynamite"" in the Department of Justice is a problem that can't be ignored."
2017-05-10T22:50:34Z,Europe view: American democracy isn't as strong as you think,"To Europeans, Trump's firing of James Comey is proof that even American democracy is not immune from the threat of authoritarian rule, writes Kate Maltby."
2017-05-11T00:14:21Z,"Comey committed 'atrocities,' Sarah Huckabee Sanders says","FBI Director James Comey committed ""atrocities"" when investigating Hillary Clinton's emails, deputy White House press secretary Sarah Huckabee Sanders said Wednesday."
2017-05-10T23:27:48Z,Rod Rosenstein: Trump's unlikely hatchet man,Deputy Attorney General Rod Rosenstein emerged this week as perhaps the most unlikely character in the politically charged drama over the firing of FBI Director James Comey.
2017-05-11T00:14:21Z,Senate intelligence committee subpoenas Michael Flynn,The Senate intelligence committee Wednesday issued a subpoena to former National Security Adviser Michael Flynn for documents regarding his interactions with Russian officials.
2017-05-10T06:01:42Z,Sean Spicer under fire during crucial week for Trump,"White House Press Secretary Sean Spicer is out of the briefing room this week, and already there is speculation that he will not return."
2017-05-10T22:44:05Z,F.B.I. Director James Comey Is Fired by Trump,"President Trump abruptly terminated Mr. Comey, who was leading an investigation into whether Mr. Trump’s advisers colluded with Russia to influence the election."
2017-05-10T23:43:08Z,"Days Before Firing, Comey Asked for More Resources for Russia Inquiry","Separately, the Senate Intelligence Committee accelerated its inquiry, issuing a subpoena to Michael T. Flynn, President Trump’s former national security adviser."
2017-05-10T11:52:38Z,Updates and Reactions to F.B.I. Director Comey’s Firing,"Mr. Comey’s dismissal drew immediate rebukes from Democrats, who worried about the ramifications for the F.B.I. investigation of Russian meddling in the election."
2017-05-10T19:38:04Z,Opinion | Trump’s Firing of Comey Is All About the Russia Inquiry,The president has now decisively crippled the F.B.I.’s ability to carry out an investigation of him and his associates.
2017-05-09T12:56:12Z,Jimmy Kimmel Responds to Critics Over Health Care,Mr. Kimmel’s monologue about his son last week came with a political message. Last night he joked that “it was insensitive” to say all children should have health care.
2017-05-10T13:41:27Z,"In Trump’s Firing of James Comey, Echoes of Watergate","Not since Watergate has a president dismissed the person leading an investigation bearing on him, and the dismissal drew instant comparisons to the Saturday Night Massacre."
2017-05-10T22:02:44Z,Why Everything We Know About Salt May Be Wrong,"Research on Russian cosmonauts suggests that salt makes you hungry but not thirsty, and may help burn calories."
2017-05-09T16:39:03Z,How Homeownership Became the Engine of American Inequality,An enormous entitlement in the tax code props up home prices — and overwhelmingly benefits the wealthy and the upper middle class.
2017-05-09T00:21:19Z,The Birth of a Mother,Becoming a mother is one of the most significant physical and psychological changes a woman will ever experience.
2017-05-10T19:54:36Z,"How a 23-Year-Old With Mild Anxiety and a Charmed Life Became the Lying, Sobbing, Lovesick Toast of Broadway",Ben Platt wrecks himself onstage in “Dear Evan Hansen.” Surviving it takes practice — and has made him a favorite to win a Tony Award.
2017-05-10T09:24:00Z,Here’s how an independent investigation into Trump and Russia would happen,Sorting out the &ldquo;special prosecutors&rdquo; from the &ldquo;independent commissions.&rdquo;
2017-05-10T12:20:00Z,Presence of Russian photographer in Oval Office raises alarms,Former U.S. intelligence officials flagged a potential security breach.
2017-05-10T11:02:00Z,"Why Trump expected only applause when he told Comey, ‘You’re fired.’",A president who operates in the moment sees no profit in considering the lessons and contradictions of the past.
2017-05-10T17:56:00Z,Analysis | Mitch McConnell just shut down any hopes Democrats had of an independent Russia investigation,"Besides frustrating Senate GOP leaders into giving in, Democrats have little to no leverage to force Congress to start an independent investigation into Trump-Russia ties."
2017-05-10T10:46:00Z,Analysis | Bob Woodward on Trump-Watergate comparisons: &#8216;Let&#8217;s see what the evidence is&#8217;,"&quot;He can do whatever he wants, within perhaps reasonable limits, so he's got the power.&quot;"
2017-05-10T12:37:00Z,Furor over Comey firing grows with news that he sought resources for Russia investigation before his dismissal,Republicans and Democrats said Comey&rsquo;s dismissal will frustrate bipartisan efforts to investigate Russian interference in the 2016 election.
2017-05-10T12:44:00Z,Senate Intelligence Committee subpoenas documents from Flynn in Russia probe,Flynn had declined the committee&rsquo;s request for materials it wanted to review.
2017-05-10T15:24:00Z,The Daily 202: Firing FBI director Comey is already backfiring on Trump. It’s only going to get worse.,"As GOP support cracks, POTUS will likely come to regret this blunder"
2017-05-10T07:37:00Z,The weird moment on Colbert’s show that captured our political whiplash,Was Comey the bad guy? Or Trump? The grounds are forever shifting under our feet these days.
,"Wait, ‘Can He Do That?’",A podcast that explores the powers and limitations of the American presidency
2017-05-10T23:08:03+00:00,General election 2017: Labour manifesto draft leaked,The document includes plans to nationalise parts of the energy industry and scrap tuition fees.
2017-05-10T22:49:14+00:00,Trump 'considered firing Comey since taking office',Democratic senators say the FBI director was seeking more resources for his Trump-Russia probe.
2017-05-10T21:32:54+00:00,Trump Russia meeting: Lavrov praises Trump and Tillerson after talks,Russia's foreign minister said the talks were dominated by improving relations and the war in Syria.
2017-05-10T19:22:46+00:00,Drayton Manor: Park to stay closed after Evha Jannath's death,Drayton Manor Theme Park will shut for a second day as Evha Jannath's family call for full inquiry.
2017-05-10T18:39:07+00:00,Women charged with terror offences and conspiracy to murder,A woman shot in a police raid is among three charged with terror offences and conspiracy to murder.
2017-05-10T23:13:27+00:00,HIV life expectancy 'near normal' thanks to new drugs,Newer medications have fewer side effects and are more efficient at stopping the virus.
2017-05-10T17:46:23+00:00,Mobile phone row driver runs cyclist over,"A motorist who chased a cyclist then deliberately crashed into him, sending him flying into a tree, has been jailed for three years."
2017-05-10T17:46:23+00:00,Mobile phone row driver runs cyclist over,"A motorist who chased a cyclist then deliberately crashed into him, sending him flying into a tree, has been jailed for three years."
2017-05-10T16:37:51+00:00,'Love rival' Cardiff woman guilty over crash death,Sophie Taylor died when her car hit a block of flats as she was chased by Melissa Pesticcio.
2017-05-10T22:13:46+00:00,Snap shares slide as growth slows,Snapchat's number of daily active users rose just 5% to 166 million in the first quarter of 2017.
2017-05-10T22:46:58Z,'They will be thanking me': Trump defends firing of FBI chief Comey,US President Donald Trump defends his firing of FBI director James Comey.
2017-05-10T18:57:07Z,So the budget is out: What happens now?,We take you through the options for the Government wanting to avoid its budget turning into a bunch of zombies.
2017-05-10T22:48:31Z,Live: Morrison stands ground as fight brews over bank tax,Treasury officials will brief the nation's biggest banks today about the Government's proposed new $6 billion levy. Follow live.
2017-05-10T14:12:54Z,"Keep temporary tax on the wealthy, Shorten to argue in budget reply",Opposition Leader Bill Shorten will use his budget reply speech to argue the Federal Government should maintain a temporary tax on high-income earners.
2017-05-10T23:31:22Z,Handy tips to avoid being locked up by US Immigration,"Overnight Canberra man Baxter Reid was released from US detention more than a week after overstaying his visa by 90 minutes, prompting the question: How easy is it to run afoul of US Immigration?"
2017-05-10T22:23:08Z,Lawyer still haunted by client's execution in Scottish prison's 'hanging shed',"Most people have a moment in their working life that shapes them. For retired Scottish defence lawyer Len Murray, it was the hanging of a young client."
2017-05-10T23:53:23Z,Classroom becomes isolation ward as spectre of cholera haunts South Sudan,"In a school classroom in drought-hit South Sudan, parents and their children lie on a bare concrete floor as they wait to find out if they will be among the first victims of a feared cholera outbreak."
2017-05-10T22:52:17Z,How not to blow your top when you're on the phone to your telco,"Consumer advocates say the almost 66,000 complaints to Australia's telecommunications watchdog in the second of half last year are just the tip of the iceberg. Here's what to do if you're having problems with your telephone or internet provider."
2017-05-10T23:17:14Z,'I struggle to make $100': Taxi drivers' desperation over Uber,"Perth taxi drivers say they face losing their homes and their retirement plans have been shattered by the rise of Uber, as they cling desperately to the hope a government review may provide them with compensation."
2017-05-10T22:41:22Z,Can Australians learn to love local fish?,Australians are opting for farmed or overseas-caught fish over local species because they simply don't recognise it.
,Defiant Trump courts Russia as probe calls grow,None
,Comey dismissal follows uniquely Trumpian way,None
,Lavrov delivers a barbed script for the Americans,None
,Little-known prosecutor under scrutiny over FBI sacking,None
,China ‘New Silk Road’ investment fell in 2016,None
,Global ETF assets reach $4tn,None
,Snap shares slump as debut earnings miss forecasts,None
,Whole Foods replaces chairman and finance chief,None
,Cable cowboy John Malone views a new landscape,None
,Toshiba technology unit sale grows more complex,None
2017-05-10T23:35:39.622Z,Flynn Subpoenaed in Russia Probe by Senate Intelligence Panel,"The Senate Intelligence Committee has subpoenaed documents from Michael Flynn, President Donald Trump’s fired national security adviser, in a sign the bipartisan probe will continue full speed ahead one day after Trump terminated FBI Director James Comey."
2017-05-10T18:30:08.062Z,"After Comey, Justice Must Be Served",Congress needs to get serious about holding the president accountable.
2017-05-10T17:42:27.625Z,What Happens to Trump-Russia Probe After Comey: QuickTake Q&A,"At the moment, the criminal probe into Russia’s meddling in the 2016 U.S. presidential election has all the stability of the Steinbrenner-era Yankees. With the U.S. attorney general self-sidelined, and the FBI director freshly fired, a makeshift lineup of law-enforcement officials now oversees an inquiry that has implications for American foreign policy, American politics and the Trump presidency. Calls for an outside prosecutor are getting louder."
2017-05-10T16:48:43.615Z,Mobius Says Low Market Volatility Is Tied to Social Media,Mark Mobius has a left-field theory on why volatility in global stock markets is so low.
2017-05-10T21:06:10.729Z,Aetna Is Latest Health Insurer to Quit Obamacare Markets,"Aetna Inc. will leave the few remaining states where it had been selling Obamacare plans next year, making it the latest health insurer to pull out of the health law as Republicans attack the program as failing and work to dismantle it."
2017-05-10T22:32:49.067Z,Uber Greyball Investigation Expands to Multiple U.S. Cities,"The city of Portland, Oregon, is starting its own investigation of Uber Technologies Inc.’s use of software to evade regulators while a U.S. Justice Department criminal probe continues in that city along with Philadelphia and Austin, Texas, according to officials."
2017-05-10T21:48:20.479Z,United Directors Sued Over Ousted CEO's Severance Package,"United Continental Holdings Inc. directors were sued by a pension fund for granting a $37 million severance package to the carrier’s former chief executive officer, who was ousted in a bribery scandal."
2017-05-10T17:39:14.264Z,Whole Foods Names Panera CEO to Board as It Faces Down Jana,"Whole Foods Market Inc., the ailing organic-grocery chain, is doing what it can to avoid a fight with activist investor Jana Partners."
2017-05-10T18:35:01.38Z,DeVos Booed Loudly by Graduates at Historically Black College,"A week after President Donald Trump suggested his administration might cut $25 million in capital funding to historically black colleges and universities, Education Secretary Betsy DeVos told Bethune-Cookman University’s class of 2017 that she “is fully committed to your success” -- a line that was met by deafening boos from the students and guests."
2017-05-10T18:27:12.379Z,Boeing Halts Flights of 737 Max on Fault in GE-Safran Engine,"Boeing Co. said it would temporarily suspend flights of its new 737 Max jetliner because of a potential manufacturing flaw in the engines, marring the commercial debut for the fastest-selling plane in company history."
2017-05-10T00:00:00+00:00,"By attacking Kurdish allies of America, Turkey risks confrontation","In both Syria and Iraq, the danger is mounting"
2017-05-10T01:38:01+00:00,President Trump abruptly sacks the head of the FBI,"The White House has changed its tune about James Comey, with far-reaching consequences"
2017-05-10T00:00:00+00:00,Moon Jae-in wins South Korea’s presidential elections by a landslide,As remarkable is how well the country’s conservatives did
2017-05-10T03:34:14+00:00,Why are Russian opposition leaders’ faces turning green?,"Critics of the Kremlin are being splashed with zelyonka, a green liquid"
2017-05-10T16:15:12+00:00,“Girlboss” is another disappointing take on female entrepreneurship,Compelling stories about successful businesswomen are scarce
2017-05-10T14:24:30+00:00,The Tory and Labour parties fail to face the realities of Brexit,"The UK will inevitably become a less attractive home for business after Brexit. The problem can be tackled, but only if politicians face up to reality"
2017-05-10T11:19:11+00:00,A mixed April for United Airlines,"Flyers, it seems, have short memories"
2017-05-10T04:00:00+00:00,Mumbai plans the world’s tallest statue,But it won’t come cheap
2017-05-09T17:08:23+00:00,The Kushners put controversial investor visas in the spotlight,"But the EB-5 visa programme should be reformed and expanded, not scrapped"
2017-05-09T17:03:47+00:00,Apocalyptic fiction and the Doomsday Clock,"As we edge closer to catastrophe, should we expect more doom-laden literature?"
PublishedAt,Title,description
2017-05-10T16:17:00Z,James Comey Sought More Resources for FBI’s Russia Probe Before Being Fired,"Former Federal Bureau of Investigation Director James Comey asked the Justice Department last week for more resources for the agency’s investigation into Russian interference in the 2016 election, a U.S. official said."
2017-05-10T23:47:39Z,Trump Fires FBI Director James Comey: Live Coverage of the Fallout,Trump Fires FBI Director James Comey: Live Coverage of the Fallout
2017-05-10T23:02:00Z,Comey Firing Casts Harsh Spotlight on Rod Rosenstein,"The firing of James Comey has cast a harsh spotlight on Deputy Attorney General Rod Rosenstein, who is less than two weeks into a job that he reached with bipartisan Senate support."
2017-05-10T23:34:00Z,"As the FBI Reels, Candidates Emerge to Run Agency","The Justice Department moved on Wednesday to find a temporary successor for fired FBI Director James Comey, as Attorney General Jeff Sessions and his top deputy interviewed five candidates amid continuing fallout over the controversial dismissal."
2017-05-10T19:26:00Z,Trump’s Firing of Comey Fans Partisan Flames in Congress,"President Trump’s firing of FBI Director James Comey thrust a debate over the appointment of a special prosecutor to the forefront of the Senate’s agenda, complicating an already halting effort to pass a health-care bill and craft a tax overhaul this year."
2017-05-10T12:21:00Z,Donald Trump Seeks to Mute Outcry from Firing of James Comey,President Trump weighed in publicly for the first time on his firing of FBI Director James Comey while top Senate Democrats questioned the timing of the ouster of the man who was investigating Trump campaign aides’ ties to Russia.
2017-05-10T22:54:00Z,Senate Committee Subpoenas Documents from Mike Flynn in Russia Probe,"The leaders of the Senate Intelligence Committee said they had requested the information in late April, but the former national security adviser had declined to cooperate."
2017-05-10T20:09:00Z,Snapchat Parent Posts $2.2 Billion Loss in First Quarterly Report; Stock Plunges,"Snap Inc. reported a $2.21 billion loss in its first quarter as a publicly traded company, magnifying the uphill battle the parent of Snapchat faces in establishing a profitable business while competing with social-media giants like Facebook and Twitter."
2017-05-10T17:15:00Z,U.S. to Expand Intelligence Cooperation With Turkey,"The U.S. is beefing up joint intelligence efforts with Turkey to help that government better target terrorists in the region, in an apparent bid to alleviate Turkish anxieties as the Pentagon implements a plan to arm Kurdish forces operating inside Syria."
2017-05-10T17:29:00Z,Whole Foods Overhauls Board; Vows Big Changes,Whole Foods is dramatically reshaping its board in an effort to show it is open to change after an activist investor last month publicly urged the organic-grocery chain to explore a sale and speed up its turnaround efforts.
2017-05-10T23:14:33Z,4 ways Trump miscalculated the Comey firing,"Donald Trump has been president for 110 days. In that time, he has fired an acting attorney general, his national security adviser, dozens of federal prosecutors, including one who was investigating him, and, on Tuesday night, the director of the FBI, James Comey."
2017-05-10T20:29:01Z,Source close to Comey says there were 2 reasons the FBI director was fired,"There are two reasons why President Donald Trump fired James Comey, according to a source close to the now-former FBI director:"
,Tapper: The real reasons Trump fired Comey - CNN Video,CNN's Jake Tapper says one of the reasons President Donald Trump fired James Comey was that the former FBI director would not give him assurance of personal loyalty.
2017-05-11T00:28:13Z,First on CNN: Comey sends farewell letter to friends and agents,"Former FBI Director James Comey, who was fired Tuesday by President Donald Trump, on Wednesday sent a letter to friends and agents. Here is the text of that letter, which was obtained by CNN."
,WH: Comey tossed 'stick of dynamite' into DOJ - CNN Video,"When asked about why President Trump was moved to fire James Comey when he previously praised him, Deputy press secretary Sarah Huckabee Sanders said that circumstances change when becoming president and throwing ""a stick of dynamite"" in the Department of Justice is a problem that can't be ignored."
2017-05-11T00:14:21Z,"Comey committed 'atrocities,' Sarah Huckabee Sanders says","FBI Director James Comey committed ""atrocities"" when investigating Hillary Clinton's emails, deputy White House press secretary Sarah Huckabee Sanders said Wednesday."
2017-05-10T23:27:48Z,Rod Rosenstein: Trump's unlikely hatchet man,Deputy Attorney General Rod Rosenstein emerged this week as perhaps the most unlikely character in the politically charged drama over the firing of FBI Director James Comey.
2017-05-11T00:14:21Z,Senate intelligence committee subpoenas Michael Flynn,The Senate intelligence committee Wednesday issued a subpoena to former National Security Adviser Michael Flynn for documents regarding his interactions with Russian officials.
2017-05-10T22:50:34Z,Europe view: American democracy isn't as strong as you think,"To Europeans, Trump's firing of James Comey is proof that even American democracy is not immune from the threat of authoritarian rule, writes Kate Maltby."
2017-05-10T20:36:03Z,Comey firing sends shockwaves through FBI rank-and-file,"News of James Comey's firing Tuesday night sent shockwaves through the FBI, where the dismissal of the generally well-liked bureau director immediately impacted the thousands of agents nationwide."
2017-05-10T22:44:05Z,F.B.I. Director James Comey Is Fired by Trump,"President Trump abruptly terminated Mr. Comey, who was leading an investigation into whether Mr. Trump’s advisers colluded with Russia to influence the election."
2017-05-10T23:43:08Z,"Days Before Firing, Comey Asked for More Resources for Russia Inquiry","Separately, the Senate Intelligence Committee accelerated its inquiry, issuing a subpoena to Michael T. Flynn, President Trump’s former national security adviser."
2017-05-10T11:52:38Z,Updates and Reactions to F.B.I. Director Comey’s Firing,"Mr. Comey’s dismissal drew immediate rebukes from Democrats, who worried about the ramifications for the F.B.I. investigation of Russian meddling in the election."
2017-05-10T19:38:04Z,Opinion | Trump’s Firing of Comey Is All About the Russia Inquiry,The president has now decisively crippled the F.B.I.’s ability to carry out an investigation of him and his associates.
2017-05-09T12:56:12Z,Jimmy Kimmel Responds to Critics Over Health Care,Mr. Kimmel’s monologue about his son last week came with a political message. Last night he joked that “it was insensitive” to say all children should have health care.
2017-05-10T13:41:27Z,"In Trump’s Firing of James Comey, Echoes of Watergate","Not since Watergate has a president dismissed the person leading an investigation bearing on him, and the dismissal drew instant comparisons to the Saturday Night Massacre."
2017-05-10T22:02:44Z,Why Everything We Know About Salt May Be Wrong,"Research on Russian cosmonauts suggests that salt makes you hungry but not thirsty, and may help burn calories."
2017-05-09T16:39:03Z,How Homeownership Became the Engine of American Inequality,An enormous entitlement in the tax code props up home prices — and overwhelmingly benefits the wealthy and the upper middle class.
2017-05-09T00:21:19Z,The Birth of a Mother,Becoming a mother is one of the most significant physical and psychological changes a woman will ever experience.
2017-05-10T19:54:36Z,"How a 23-Year-Old With Mild Anxiety and a Charmed Life Became the Lying, Sobbing, Lovesick Toast of Broadway",Ben Platt wrecks himself onstage in “Dear Evan Hansen.” Surviving it takes practice — and has made him a favorite to win a Tony Award.
2017-05-10T09:24:00Z,Here’s how an independent investigation into Trump and Russia would happen,Sorting out the &ldquo;special prosecutors&rdquo; from the &ldquo;independent commissions.&rdquo;
2017-05-10T12:26:00Z,Presence of Russian photographer in Oval Office raises alarms,Former U.S. intelligence officials flagged a potential security breach.
2017-05-10T11:02:00Z,"Why Trump expected only applause when he told Comey, ‘You’re fired.’",A president who operates in the moment sees no profit in considering the lessons and contradictions of the past.
2017-05-10T17:56:00Z,Analysis | Mitch McConnell just shut down any hopes Democrats had of an independent Russia investigation,"Besides frustrating Senate GOP leaders into giving in, Democrats have little to no leverage to force Congress to start an independent investigation into Trump-Russia ties."
2017-05-10T10:46:00Z,Analysis | Bob Woodward on Trump-Watergate comparisons: &#8216;Let&#8217;s see what the evidence is&#8217;,"&quot;He can do whatever he wants, within perhaps reasonable limits, so he's got the power.&quot;"
