PublishedAt,Title,description
2017-05-09T21:27:00.926Z,Billionaire Carl Icahn Loses $179 Million on Hertz Double Down,"When billionaire Carl Icahn bought into Hertz Global Holdings Inc. in summer 2014, he said he thought the shares were undervalued. With prices down almost 90 percent in the years since, he might be wishing he could take that one back."
2017-05-09T21:30:59.032Z,China Is Building a Disney World for Wine,"Changyu, China's winemaking powerhouse, is building French-style chateaus and Italianate castles around the country—and an entire ""Wine City""—to encourage the country's passion for the grape."
2017-05-09T19:48:06.485Z,Shale Drillers Are Outspending the World With $84 Billion Spree,U.S. shale explorers are boosting drilling budgets 10 times faster than the rest of the world to harvest fields that register fat profits even with the recent drop in oil prices.
2017-05-09T18:55:38.422Z,Senate GOP Plans Secret Health Debate That May Take Months,Senate Republican leaders are starting what’s shaping up to be a secretive process to write their version of an Obamacare overhaul -- even after some GOP senators complained that the House devised sweeping health-care legislation behind closed doors.
2017-05-09T21:09:45.435Z,Apple Becomes First U.S. Company to Top $800 Billion Value,Apple Inc. became the first U.S. company with a market value of more $800 billion as investors bet the next iPhone will spur a resurgence in sales.
2017-05-09T19:38:54.479Z,Wal-Mart Close to Resolving Bribery Probe for $300 Million,"Wal-Mart Stores Inc. is preparing to pay roughly $300 million to resolve a long-running U.S. investigation into allegations of bribery by its employees, according to people familiar with the matter."
2017-05-09T23:01:00.009Z,Canadian Fund With $6 Billion War Chest Picks London for EU Hub,The Public Sector Pension Investment Board picked London as its European hub and plans to spend as much as 4.6 billion pounds ($6 billion) in the region in the next five years.
2017-05-09T19:37:29.399Z,Blankfein Says Banks Should Be Unshackled From Volcker Rule,"U.S. banks with federally insured deposits should be freed from Volcker Rule restrictions that prevent them from taking some types of principal risk, a market-making function that provides a valuable public service, Goldman Sachs Group Inc. Chief Executive Officer Lloyd Blankfein said."
2017-05-09T17:31:46.285Z,Jailed SAC Manager Martoma Seeks New Insider-Trading Trial,"More than two years after Mathew Martoma began serving a nine-year prison term for insider trading, his lawyer argued for a second time that the former SAC Capital Advisors LP portfolio manager deserves a new trial."
2017-05-04T14:54:55+00:00,Cancer drugs are getting better and dearer,"AstraZeneca’s Imfinzi costs $180,000 for a year’s treatment"
2017-05-09T00:00:00+00:00,Businessmen start to replace soldiers as Israel’s political heroes,The top brass are in retreat
2017-05-09T20:23:26+00:00,An appeals court is unlikely to lift the stay on the travel ban,Few judges seem willing to overlook Donald Trump's statements expressing antipathy toward Muslims
2017-05-04T14:54:55+00:00,China faces resistance to a cherished theme of its foreign policy,Silk routes are not always as appealing as they sound
2017-05-09T17:08:23+00:00,The Kushners put controversial investor visas in the spotlight,"But the EB-5 visa programme should be reformed and expanded, not scrapped"
2017-05-09T17:03:47+00:00,Apocalyptic fiction and the Doomsday Clock,"As we edge closer to catastrophe, should we expect more doom-laden literature?"
2017-05-04T14:54:55+00:00,"Another Eurovision song contest, another diplomatic crisis",What happens when cheesy pop meets politics
2017-05-09T00:00:00+00:00,"Britain is leaving the EU, but its language will stay","Despite Jean-Claude Juncker’s joke, Anglophones should rest easy"
2017-05-09T14:58:03+00:00,Emmanuel Macron has a history buff’s view of Islam and religious strife,France’s new president is less stringent about secularism than some of his compatriots
2017-05-09T14:22:03+00:00,America may extend its laptop ban to cover flights from Europe,"If it does, the true motives of the administration will become clearer"
PublishedAt,Title,description
2017-05-09T21:50:00Z,Trump Fires James Comey as FBI Chief,"President Donald Trump fired James Comey as director of the Federal Bureau of Investigation, citing his handling of the investigation into Hillary Clinton’s email server. The dismissal ignited a firestorm over how the decision would impact the agency’s investigation into possible collusion between the Trump campaign and Russia."
,"White House, Justice Department Statements",None
2017-05-10T01:27:00Z,"Timeline: Clinton’s Emails, Trump’s Tweets and Comey’s Fall",Former FBI Director James Comey’s handling of the Hillary Clinton email investigation stirred controversy during the most unpredictable presidential campaign in modern history. A look at some key dates leading to Mr. Comey’s firing.
2017-05-10T02:12:00Z,"Trump’s Possible Picks for Next FBI Chief Include Judges, Former Bush Officials","Larry Thompson, Robert Conrad or Frances Townsend could make the list of candidates, as presidents have often turned to former U.S. attorneys and judges to fill the job."
2017-05-10T02:20:00Z,President Trump Says FBI Chief James Comey Exonerated Him in Russia Probe,"The president said in a letter that FBI Director James Comey told him three times that he wasn’t under investigation, although the FBI has yet to accuse or excuse anyone in the probe."
2017-05-10T02:49:00Z,Shortened Tenures Are Norm Atop FBI,"The ouster of James Comey as FBI director was swift and sudden, but a tenure cut short has been more the rule in Washington than the exception."
2017-05-10T03:00:00Z,"Before James Comey’s Dismissal, a Growing Frustration at White House","In the months before James Comey’s dismissal, frustration was growing among top associates of President Donald Trump that the FBI director wouldn’t publicly tamp down questions about possible collusion with Russian interference in the 2016 presidential race."
2017-05-10T00:40:00Z,Comey Dismissal Upends Probes of Trump Campaign Ties to Russia,President Donald Trump’s decision to fire the head of the FBI in the midst of the bureau’s probe into possible links between his presidential campaign and Russia added impetus to calls for a special counsel to handle the case.
2017-05-09T18:12:00Z,"Trump Set to Arm Kurds in ISIS Fight, Angering Turkey","President Donald Trump approved plans to directly arm Kurdish fighters battling Islamic State in Syria, U.S. officials said Tuesday, paving the way for an offensive against the extremist group’s de facto capital."
2017-05-09T20:00:03Z,Apple’s Latest Record: An $800 Billion Market Cap,"Shares of were up 0.8% Tuesday to $154.31. With that, its market value is poised to finish the day above $800 billion on Tuesday-- a first for any U.S. company."
2017-05-10T00:49:33Z,Trump fires FBI director James Comey,"President Donald Trump on Tuesday fired FBI Director James Comey, sweeping away the man who is responsible for the bureau's investigation into whether members of his campaign team colluded with Russia in its interference in last year's election."
2017-05-09T22:15:42Z,Trump's letter firing FBI Director James Comey,"President Donald Trump fired FBI Director James Comey on May 9, 2017."
,Cooper to Conway: Your answer makes no sense - CNN Video,"In an interview with CNN's Anderson Cooper, Kellyanne Conway discusses President Donald Trump firing of FBI Director James Comey."
2017-05-10T03:12:51Z,Comey firing troubles top Republican lawmakers,"Top Republicans, including the senator directing the Senate's Russia investigation, said Tuesday they were ""troubled"" by President Donald Trump's firing of FBI Director James Comey, while other GOP lawmakers tried to stay out of the growing political storm."
,Toobin: Firing Comey grotesque abuse of power - CNN Video,CNN Senior Legal Analyst Jeffrey Toobin says President Trump firing FBI Director James Comey is a grotesque abuse of power.
2017-05-10T02:22:30Z,James Comey's fall,James Comey came to the FBI with a hero's reputation: He famously stood up to  President George W. Bush's aides in a dramatic hospital-room confrontation over secret wiretapping.
2017-05-10T01:50:58Z,Firing James Comey is Donald Trump's most unpredictable and dangerous move yet,James Comey found out he had been fired as FBI director just like the rest of us: By watching it on television.
,Crowd boos at town hall over special prosecutor - CNN Video,Republican Congressman Dave Brat was met with boos from the crowd at a town hall when he didn't immediately say there should be a special prosecutor appointed to the Russia investigation.
2017-05-10T00:30:58Z,"Clinton aides react to Comey firing with concern, not joy","There were few people who despised James Comey more than those political operatives working for Hillary Clinton in Brooklyn during the 2016 campaign. But word of the FBI director's firing was met with fear, not joy, on Tuesday."
2017-05-10T01:24:25Z,CNN exclusive: Grand jury subpoenas issued in FBI's Russia investigation,"Federal prosecutors have issued grand jury subpoenas to associates of former National Security Advisor Michael Flynn seeking business records, as part of the ongoing probe of Russian meddling in last year's election, according to people familiar with the matter."
2017-05-10T03:22:45Z,F.B.I. Director James Comey Is Fired by Trump,"President Trump abruptly terminated Mr. Comey, who was leading an investigation into whether Mr. Trump’s advisers colluded with Russia to influence the election."
2017-05-09T06:36:43Z,"Obama Warned Trump About Hiring Flynn, Officials Say",Former President Barack Obama warned Donald J. Trump in their conversation in the Oval Office two days after the election.
2017-05-09T06:30:37Z,6 Takeaways From Monday’s Senate Hearing on Russia,Sally Q. Yates and James R. Clapper Jr. testified at a hearing that was focused on when the White House knew about conversations that Michael T. Flynn had with the Russian ambassador.
2017-05-09T16:18:41Z,Why Everything We Know About Salt May Be Wrong,"Research on Russian cosmonauts suggests that salt makes you hungry but not thirsty, and may help burn calories."
2017-05-08T13:35:53Z,E.P.A. Dismisses Members of Major Scientific Review Board,A spokesman for the agency’s administrator said he would consider replacing the academic scientists with representatives from industries the agency is supposed to regulate.
2017-05-09T12:56:12Z,Jimmy Kimmel Responds to Critics Over Health Care,Mr. Kimmel’s monologue about his son last week came with a political message. Last night he joked that “it was insensitive” to say all children should have health care.
2017-05-09T00:21:19Z,The Birth of a Mother,Becoming a mother is one of the most significant physical and psychological changes a woman will ever experience.
2017-05-08T16:22:00Z,Patrick Buchanan Reveals Himself to Be the First Trumpist,"In “Nixon’s White House Wars,” it’s Patrick Buchanan, not Nixon, who emerges as the most intriguing character in the entertaining book."
2017-05-10T03:26:00Z,Updates and Reactions to F.B.I. Director Comey’s Firing,"Mr. Comey’s dismissal drew immediate rebukes from Democrats, who worried about the ramifications for the F.B.I. investigation of Russian meddling in the election."
2017-05-09T17:46:57Z,Tiffany Trump Will Attend Georgetown Law,"The 23-year-old daughter of President Trump and Marla Maples, his second wife, will follow in the steps of two of her siblings."
2017-05-09T16:34:00Z,Comey’s removal sparks fears about future of Russia probe,"While career agents are working the case, legislators are intensifying their calls for an independent probe."
2017-05-09T13:49:00Z,Analysis | The shocking firing of James B. Comey puts new pressure on Trump and his team,"After the surprise dismissal, the president will face renewed pressure for a special prosecutor to take over the Russia investigation."
2017-05-09T13:45:00Z,‘This terrifies me’: Ex-Clinton aides slam Trump’s firing of FBI director Comey,Democrats said Comey botched the Clinton email probe but was dismissed for political reasons.
2017-05-09T12:28:00Z,White House dismisses questions over why it waited to fire Michael Flynn,The administration said the warnings about Flynn came from a “political opponent” of the president.
2017-05-09T14:35:00Z,President Trump fires FBI Director Comey,"The startling move, officials said, stemmed from a conclusion by Justice Department officials that he had mishandled the probe of Hillary Clinton’s emails. Comey was fired as he is leading a counterintelligence investigation to determine whether associates of President Trump may have coordinated with Russia to meddle with the presidential election last year."
2017-05-09T12:49:00Z,"Analysis | The Justice Department’s case against James B. Comey, annotated",The letter is heavy on quotes from media reports and light on new information -- leading some to suggest it was cobbled together quickly.
2017-05-09T13:21:00Z,Comey’s ouster provides quick test for new deputy attorney general,"Low-key, bipartisan prosecutor Rod J. Rosenstein authored memo behind FBI director’s dismissal"
2017-05-09T14:05:00Z,Tuesday night firing of Comey: ‘Nixonian’ or uniquely Trumpian?,"Within minutes, the words “Saturday Night Massacre” swept across a stunned capital."
2017-05-09T10:31:00Z,Senate Republicans face their own divisions in push for health-care overhaul,"After a narrow House vote, the GOP still faces challenges to get a bill to President Trump."
2017-05-09T07:56:00Z,Analysis | Will Republican senators pass the GOP health-care bill? Here’s what they’re saying so far.,President Trump is “confident” that the Senate will pass a bill — but it could take a while.
2017-05-10T02:53:46+00:00,FBI chief James Comey fired by Trump,"The White House says he was sacked for botching the Clinton email probe, but critics see a cover-up."
2017-05-10T01:32:52+00:00,General election 2017: Labour and Lib Dems pledge school cash,"Labour would raise corporation tax for a £5bn investment - the Tories call the plans ""nonsensical""."
2017-05-09T23:14:05+00:00,Conservative election expenses charging decision due,Prosecutors have been examining police files on the way Conservative campaign costs were recorded.
2017-05-09T21:51:49+00:00,"Girl, 11, dies after Drayton Manor theme park fall",Police say the girl was on a school trip when she fell into the water on the Splash Canyon ride.
2017-05-09T23:47:04+00:00,'Heart attack risk' for common Nsaid painkillers,New evidence adds to previous studies suggesting a link between Nsaids and heart harm.
2017-05-10T01:32:43+00:00,Australian politician becomes first to breastfeed in parliament,Politician Larissa Waters makes history by breastfeeding her baby on the Senate floor.
2017-05-09T16:22:58+00:00,Aine Davis guilty of being senior Islamic State member,"Londoner Aine Davis, suspected of being associate of man known as Jihadi John, is jailed in Turkey."
2017-05-09T22:41:37+00:00,Syria war: US to arm Kurds in battle for Raqqa,The move will help Kurdish fighters battling IS for Raqqa but will alarm neighbouring Turkey.
2017-05-10T00:14:34+00:00,Venezuela sees sharp rise in infant and maternal mortality,The Venezuelan government publishes new data showing a 30% rise in child deaths.
2017-05-09T19:53:52+00:00,Philip May: 'I take the bins out',Theresa May and her husband tell the One Show there's no negotiation over the domestic chores.
2017-05-10T03:34:42Z,Budget 2017: Winners and losers,Find out who scores and who misses out in Treasurer Scott Morrison's second budget.
2017-05-10T03:28:42Z,Live: Morrison pleads with banks not to pass the buck,Treasurer Scott Morrison uses his traditional post-budget address to urge banks not to pass on the costs of a new $6 billion levy to consumers. Follow live.
2017-05-10T01:21:05Z,Questions raised after Trump sacks FBI boss amid Russia probe,Donald Trump abruptly fires FBI director James Comey in the midst of an investigation into whether his campaign had ties to Russia's election meddling.
2017-05-10T02:29:55Z,George Calombaris charged with assault,Celebrity chef George Calombaris is charged with assault after an altercation that followed the A-League grand final.
2017-05-10T03:00:15Z,Man lobbed pie at Qantas boss 'to oppose gay marriage',The man who smashed a lemon meringue pie into the face of Qantas chief executive Alan Joyce yesterday says he wanted to make a statement about marriage equality.
2017-05-10T03:42:21Z,"Clive Palmer testifies in court, says he has memory loss due to morphine","Clive Palmer briefly testifies at court proceedings in Brisbane into the collapse of Queensland Nickel, saying he is in great pain and suffers from memory loss due to morphine."
2017-05-10T03:38:39Z,Who's said what about the budget,Everyone's divided about where they stand on the major issues outlined in this year's budget. Here's a quick guide to who's said what about the budget.
2017-05-09T23:12:40Z,Will the Government's new measures get through the Senate?,"A multi-billion-dollar hit on Australia's biggest banks will likely be waved through the Senate with the support of Labor and the Greens, but the passage of other measures remains less clear-cut."
2017-05-09T11:37:07Z,It turns out Turnbull is really quite good at tidying up old messes,"You can tell a lot about a budget by looking at who it punishes. This one basically targets anyone who's ever appeared on A Current Affair accompanied by a low, menacing soundtrack, writes Annabel Crabb"
2017-05-09T20:11:19Z,Your budget cheat sheet (so you know why everyone's paying more tax),We've dug through the budget papers to find all the important bits so you don't have to.
,Trump ‘terminates’ FBI director Comey,None
,Trump’s Tuesday night massacre,None
,James Comey’s downfall: a timeline of controversy,None
,Comey dismissal: US lawmakers react on Twitter,None
,S Korea’s new president set to rebalance region,None
,Toutiao touts personal news app for populous China,None
,Apple leads US stocks to new ‘earnings trade’ high,None
,Senators demand investigation into Icahn trades,None
,Xi’s Silk Road under threat from one-way traffic,None
,Trump’s tax plan tries to take away the drinks tray,None
2017-05-10T02:34:06.654Z,Comey Firing Poses Toughest Test Yet for Senate's Russia Probe,The most prominent congressional investigation into Russian meddling in the U.S. election -- and possible ties to President Donald Trump’s campaign -- faces its toughest test yet after the firing of FBI Director James Comey.
2017-05-09T21:27:00.926Z,Billionaire Carl Icahn Loses $179 Million on Hertz Double Down,"When billionaire Carl Icahn bought into Hertz Global Holdings Inc. in summer 2014, he said he thought the shares were undervalued. With prices down almost 90 percent in the years since, he might be wishing he could take that one back."
2017-05-09T21:30:59.032Z,China Is Building a Disney World for Wine,"Changyu, China's winemaking powerhouse, is building French-style chateaus and Italianate castles around the country—and an entire ""Wine City""—to encourage the country's passion for the grape."
2017-05-09T19:48:06.485Z,Shale Drillers Are Outspending the World With $84 Billion Spree,U.S. shale explorers are boosting drilling budgets 10 times faster than the rest of the world to harvest fields that register fat profits even with the recent drop in oil prices.
2017-05-09T18:55:38.422Z,Senate GOP Plans Secret Health Debate That May Take Months,Senate Republican leaders are starting what’s shaping up to be a secretive process to write their version of an Obamacare overhaul -- even after some GOP senators complained that the House devised sweeping health-care legislation behind closed doors.
2017-05-09T21:09:45.435Z,Apple Becomes First U.S. Company to Top $800 Billion Value,Apple Inc. became the first U.S. company with a market value of more $800 billion as investors bet the next iPhone will spur a resurgence in sales.
2017-05-09T19:38:54.479Z,Wal-Mart Close to Resolving Bribery Probe for $300 Million,"Wal-Mart Stores Inc. is preparing to pay roughly $300 million to resolve a long-running U.S. investigation into allegations of bribery by its employees, according to people familiar with the matter."
2017-05-09T23:01:00.009Z,Canadian Fund With $6 Billion War Chest Picks London for EU Hub,The Public Sector Pension Investment Board picked London as its European hub and plans to spend as much as 4.6 billion pounds ($6 billion) in the region in the next five years.
2017-05-09T19:37:29.399Z,Blankfein Says Banks Should Be Unshackled From Volcker Rule,"U.S. banks with federally insured deposits should be freed from Volcker Rule restrictions that prevent them from taking some types of principal risk, a market-making function that provides a valuable public service, Goldman Sachs Group Inc. Chief Executive Officer Lloyd Blankfein said."
2017-05-09T17:31:46.285Z,Jailed SAC Manager Martoma Seeks New Insider-Trading Trial,"More than two years after Mathew Martoma began serving a nine-year prison term for insider trading, his lawyer argued for a second time that the former SAC Capital Advisors LP portfolio manager deserves a new trial."
2017-05-04T14:54:55+00:00,Cancer drugs are getting better and dearer,"AstraZeneca’s Imfinzi costs $180,000 for a year’s treatment"
2017-05-09T00:00:00+00:00,Businessmen start to replace soldiers as Israel’s political heroes,The top brass are in retreat
2017-05-09T20:23:26+00:00,An appeals court is unlikely to lift the stay on the travel ban,Few judges seem willing to overlook Donald Trump's statements expressing antipathy toward Muslims
2017-05-04T14:54:55+00:00,China faces resistance to a cherished theme of its foreign policy,Silk routes are not always as appealing as they sound
2017-05-09T17:08:23+00:00,The Kushners put controversial investor visas in the spotlight,"But the EB-5 visa programme should be reformed and expanded, not scrapped"
2017-05-09T17:03:47+00:00,Apocalyptic fiction and the Doomsday Clock,"As we edge closer to catastrophe, should we expect more doom-laden literature?"
2017-05-04T14:54:55+00:00,"Another Eurovision song contest, another diplomatic crisis",What happens when cheesy pop meets politics
2017-05-09T00:00:00+00:00,"Britain is leaving the EU, but its language will stay","Despite Jean-Claude Juncker’s joke, Anglophones should rest easy"
2017-05-09T14:58:03+00:00,Emmanuel Macron has a history buff’s view of Islam and religious strife,France’s new president is less stringent about secularism than some of his compatriots
2017-05-09T14:22:03+00:00,America may extend its laptop ban to cover flights from Europe,"If it does, the true motives of the administration will become clearer"
PublishedAt,Title,description
2017-05-10T16:17:00Z,James Comey Sought More Resources for FBI’s Russia Probe Before Being Fired,"Former Federal Bureau of Investigation Director James Comey asked the Justice Department last week for more resources for the agency’s investigation into Russian interference in the 2016 election, a U.S. official said."
2017-05-10T23:47:39Z,Trump Fires FBI Director James Comey: Live Coverage of the Fallout,Trump Fires FBI Director James Comey: Live Coverage of the Fallout
2017-05-10T23:02:00Z,Comey Firing Casts Harsh Spotlight on Rod Rosenstein,"The firing of James Comey has cast a harsh spotlight on Deputy Attorney General Rod Rosenstein, who is less than two weeks into a job that he reached with bipartisan Senate support."
2017-05-10T23:34:00Z,"As the FBI Reels, Candidates Emerge to Run Agency","The Justice Department moved on Wednesday to find a temporary successor for fired FBI Director James Comey, as Attorney General Jeff Sessions and his top deputy interviewed five candidates amid continuing fallout over the controversial dismissal."
2017-05-10T05:28:00Z,"Trump, Top Russian Envoy Don’t Discuss Alleged Meddling in U.S. Election","President Donald Trump​didn’t raise the issue of Russia’s alleged interference in the 2016 U.S. elections during an Oval Office meeting, Russian Foreign Minister Sergei Lavrov said, dismissing the hacking charges as “not serious.”"
2017-05-10T12:21:00Z,Donald Trump Defends His Firing of James Comey,President Trump on Wednesday explained his firing of FBI Director James Comey while top Senate Democrats questioned the timing of the ouster of the man who was investigating Trump campaign aides’ ties to Russia.
2017-05-10T22:54:00Z,Senate Committee Subpoenas Documents from Mike Flynn in Russia Probe,"The leaders of the Senate Intelligence Committee said they had requested the information in late April, but the former national security adviser had declined to cooperate."
2017-05-10T20:09:00Z,Snapchat Parent Posts $2.2 Billion Loss in First Quarterly Report; Stock Plunges,"Snap Inc. reported a $2.21 billion loss in its first quarter as a publicly traded company, magnifying the uphill battle the parent of Snapchat faces in establishing a profitable business while competing with social-media giants like Facebook and Twitter."
2017-05-10T17:15:00Z,U.S. to Expand Intelligence Cooperation With Turkey,"The U.S. is beefing up joint intelligence efforts with Turkey to help that government better target terrorists in the region, in an apparent bid to alleviate Turkish anxieties as the Pentagon implements a plan to arm Kurdish forces operating inside Syria."
